EVENT_ID,CZ_NAME_STR,BEGIN_LOCATION,BEGIN_DATE,BEGIN_TIME,EVENT_TYPE,MAGNITUDE,TOR_F_SCALE,DEATHS_DIRECT,INJURIES_DIRECT,DAMAGE_PROPERTY_NUM,DAMAGE_CROPS_NUM,STATE_ABBR,CZ_TIMEZONE,MAGNITUDE_TYPE,EPISODE_ID,CZ_TYPE,CZ_FIPS,WFO,INJURIES_INDIRECT,DEATHS_INDIRECT,SOURCE,FLOOD_CAUSE,TOR_LENGTH,TOR_WIDTH,BEGIN_RANGE,BEGIN_AZIMUTH,END_RANGE,END_AZIMUTH,END_LOCATION,END_DATE,END_TIME,BEGIN_LAT,BEGIN_LON,END_LAT,END_LON,EVENT_NARRATIVE,EPISODE_NARRATIVE,ABSOLUTE_ROWNUMBER
5131051,BAXTER CO.,JORDAN,01/03/2000,622,Tornado, ,F1,0,0,0,0,AR,CST, ,1090926,C,5,LZK,0,0,NWS STORM SURVEY, ,1.8,40,1,S,2,E,JORDAN,01/03/2000,625,36.22,-92.18,36.23,-92.15,"A weak tornado was spawned in eastern Baxter County just south of Jordan. The tornado moved northeast, destroying a travel trailer and blowing over two 53-foot semi truck trailers in the Rodney community. One of the trailers fell on a new truck tractor. The tornado then moved into western Izard County.","",1
5131052,IZARD CO.,DOLPH,01/03/2000,625,Tornado, ,F1,0,0,0,0,AR,CST, ,1090927,C,65,LZK,0,0,NWS STORM SURVEY, ,3,40,3,W,2,NNE,DOLPH,01/03/2000,630,36.23,-92.17,36.25,-92.10,"A weak tornado moved from eastern Baxter County into western Izard County, heading to the northeast. A couple of turkey houses were heavily damaged north of Dolph, with several trees downed as well. The tornado eventually dissipated about 2 miles north-northeast of Dolph.","",2
5131397,IZARD CO.,WISEMAN,01/03/2000,646,Tornado, ,F1,0,0,0,0,AR,CST, ,1090933,C,65,LZK,0,0,NWS STORM SURVEY, ,1.8,40,1,SW,1,NE,WISEMAN,01/03/2000,648,36.22,-91.83,36.23,-91.80,"A weak tornado was spawned in northeastern Izard County about a mile southwest of Wiseman. The tornado moved northeast, and damaged the roofs of 9 residences in or near Wiseman, with the damage mostly due to falling trees or tree limbs. Several roofs lost shingles, including the local community center. A few windows were broken as well. The tornado dissipated about about 0.7 mile northeast of Wiseman.","",3
5131398,FULTON CO.,AGNOS,01/03/2000,650,Tornado, ,F1,0,0,0,0,AR,CST, ,1090934,C,49,LZK,0,0,NWS STORM SURVEY, ,2,40,1,WNW,2,NNE,AGNOS,01/03/2000,653,36.25,-91.70,36.28,-91.67,"A weak tornado was spawned in southeastern Fulton County about 1.2 miles west-northwest of Agnos.
The tornado moved northeast and destroyed a couple of barns and a large shed, and a few houses lost some roof shingles as well. The tornado dissipated about 1.5 miles north-northeast of Agnos.","",4
5131638,FULTON CO.,FRYATT,01/03/2000,655,Tornado, ,F1,0,0,0,0,AR,CST, ,1090935,C,49,LZK,0,0,NWS STORM SURVEY, ,3.1,40,0,WSW,3,ENE,FRYATT,01/03/2000,700,36.47,-91.65,36.48,-91.60,"A weak tornado was spawned in northeastern Fulton County about 0.3 mile west-southwest of Fryatt.  The tornado moved northeast and downed hundreds of trees, mostly along Arkansas Highway 9.  One house was badly damaged by falling trees.  A barn roof was also blown off, and some outbuildings were damaged as well.  The tornado dissipated about 2.8 miles east-northeast of Fryatt.","",5
5131031,LEFLORE CO.,SCHLATER,01/03/2000,1215,Tornado, ,F1,0,0,45000,0,MS,CST, ,1090744,C,83,JAN,0,0,EMERGENCY MANAGER, ,3,150,1,SW,2,NE,SCHLATER,01/03/2000,1218,33.63,-90.37,33.67,-90.33,"This weak tornado nearly destroyed a mobile home and a barn. Numerous trees were snapped off or blown down.","",6
5129620,YALOBUSHA CO.,WATER VLY,01/03/2000,1330,Tornado, ,F2,0,0,100000,0,MS,CST, ,1090549,C,161,MEG,0,0,NWS STORM SURVEY, ,2.2,300,5,E,7,NE,WATER VLY,01/03/2000,1340,34.17,-89.55,34.23,-89.55,"The tornado first developed just south of Highway 315 in the community of Hawkins Crossing and moved northeast across the northeast corner of Yalobusha county. The tornado continued into southwest Lafayette county and continued to travel northeast ending in Union county. One home was blown three feet off its foundation with only the west facing wall left standing. Two mobile homes were completely destroyed. Nine other homes and one barn recieved moderate to extensive damage.","",7
5129728,LAFAYETTE CO.,PARIS,01/03/2000,1340,Tornado, ,F2,0,3,100000,0,MS,CST, ,1090549,C,71,MEG,0,0,NWS STORM SURVEY, ,21,150,3,W,5,N,LAFAYETTE SPGS,01/03/2000,1400,34.18,-89.52,34.37,-89.27,"The tornado first developed just south of Highway 315 in the community of Hawkins Crossing and moved northeast across the northeast corner of Yalobusha county. The tornado continued into southwest Lafayette county and continued to travel northeast ending in Union county. In the town of Paris in the southwest part of the county, a frame house was lifted off its foundation with the back end of the house completely blown out. One person in the house was injured. A nearby house under construction was severly damaged. Several other homes in the area received minor damage and numerous trees were snapped or uprooted.  The tornado also produced some damage in the towns of Denmark and Lafayette Springs.","",8
5129729,UNION CO.,PINEDALE,01/03/2000,1400,Tornado, ,F3,0,4,250000,0,MS,CST, ,1090549,C,145,MEG,0,0,NWS STORM SURVEY, ,20,600,4,SW,3,NE,MYRTLE,01/03/2000,1410,34.37,-89.25,34.60,-89.08,"The tornado first developed just south of Highway 315 in the community of Hawkins Crossing and moved northeast across the northeast corner of Yalobusha county. The tornado continued into southwest Lafayette county and continued to travel northeast ending in Union county. In the town of Pinedale in southwest Union county, a new brick and vinyl siding home was obliterated. The debris extended up to 400 yards where a large freezer landed in a lake. A nearby pickup truck was rolled 20 yards and sustained extensive damage. Trees two to three feet in diameter were completely uprooted. In the town of Enterprise, a mobile home was completely destroyed and a conventional home sustained severe damage. Four other homes received extensive structural damage. The West Union School had minor roof damage and had numerous windows blown out.  In the town of Myrtle, two mobile homes were destroyed and another mobile home was flipped on its side. In all, more than 60 homes were damaged in Union county.","",9
5129129,WASHINGTON CO.,FREDDRICKSBURG,01/03/2000,1405,Tornado, ,F1,0,0,47000,0,IN,EST, ,1090502,C,175,LMK,0,0,NWS STORM SURVEY, ,.3,50,3,N,3,N,FREDDRICKSBURG,01/03/2000,1405,38.47,-86.18,38.47,-86.18,"A tornado touched down in Washington county not far from the Harrison county line.  The tornado destroyed 1 mobile home, moved 1 mobile home off its foundation, and caused roof damage to a house and a barn before lifting about a quarter of a mile from when it started.","",10
5133317,CRITTENDEN CO.,CRAYNE,01/03/2000,1508,Tornado, ,F3,0,3,5000000,0,KY,CST, ,1091088,C,55,PAH,0,0,NWS STORM SURVEY, ,15,440, , ,5,NE,SHADEY GROVE,01/03/2000,1523,37.27,-88.08,37.37,-87.82,"Although the tornado tracked about 15 miles through the county with estimated top winds of 160 MPH, damage was relatively light due to the rural nature of the land. Based on aerial surveys, structures that were heavily damaged or destroyed included 85 homes, 5 to 10 businesses, and 50 to 80 barns and outbuildings.  Three people in the Crayne area were transported to a hospital for non life-threatening injuries. About 35 National Guard personnel were deployed to Crittenden County, primarily for damage assessment and security operations. An emergency shelter was opened to accomodate roughly 25 homeless persons.","",11
5131965,WEBSTER CO.,DIAMOND,01/03/2000,1523,Tornado, ,F3,0,0,2400000,0,KY,CST, ,1091088,C,233,PAH,0,0,NWS STORM SURVEY, ,9,440,3,SW,6,NE,DIAMOND,01/03/2000,1532,37.37,-87.85,37.48,-87.73,"The tornado caused extensive damage in the community of Diamond. Both Crittenden and Webster Counties were declared federal disaster areas.","",12
5132346,DAVIESS CO.,ROME,01/03/2000,1606,Tornado, ,F3,0,18,64000000,0,KY,CST, ,1091086,C,59,PAH,0,0,NWS STORM SURVEY, ,7,880, , , , ,OWENSBORO,01/03/2000,1612,37.72,-87.18,37.77,-87.12,"The tornado first touched down near the community of Rome,  just southwest of Owensboro, and entered the city near the southern boundary of Owensboro Airport. The tornado tracked northeast through the heart of Owensboro before dissipating on the east side of town. Peak winds were estimated at 180 MPH. Since the tornado path was mostly through densely populated residential and commercial areas, damage was in the tens of millions, but injuries were surprisingly few. Of the 18 injuries, one was critical, and the rest were relatively minor. The critically injured person was in a home near the beginning of the damage path. This person sustained broken vertebrae and numerous cuts and bruises. Owensboro landmarks  heavily damaged by the tornado included Apollo High School, Kentucky Wesleyan College, and the Winn-Dixie Store.  Damage to the 12 buildings at Kentucky Wesleyan College was estimated to be near 5 million dollars. Small to mid size automobiles were tossed about by the wind. Damage to utility lines was extensive, and repairs took about 10 days to complete. Final damage tallies showed about 1200 homes and businesses sustained damage. Of those 1200 structures, 101 were totally destroyed and 573 sustained major damage. Owensboro was declared a federal disaster area. An emergency shelter accomodated roughly 150 persons, including many from local nursing homes. Owensboro schools were closed for a week.","",13
5131040,JASPER CO.,GARLANDVILLE,01/03/2000,1729,Tornado, ,F2,0,0,125000,0,MS,CST, ,1090753,C,61,JAN,0,0,EMERGENCY MANAGER, ,4,300,3,SW,1,NE,GARLANDVILLE,01/03/2000,1733,32.18,-89.15,32.23,-89.10,"This strong tornado nearly destroyed a cinder-block convenience store. One house received major damage as its roof was thrown about fifty yards away. A mobile home was blown off of its foundation and thrown about fifty yards into adjacent woods where it was left in total destruction. Several barns and sheds were either destroyed or received major damage. Several hundred trees were either blown down or snapped off.  There were no injuries or fatalities.  The tornado left north central Jasper County and  moved into south central Newton County.","",14
5132822,NEWTON CO.,NEWTON,01/03/2000,1733,Tornado, ,F1,0,0,40000,0,MS,CST, ,1090754,C,101,JAN,0,0,NWS STORM SURVEY, ,2,120,8,S,9,SE,NEWTON,01/03/2000,1736,32.18,-89.17,32.22,-89.05,"This tornado move into south central Newton County from north central Jasper County. It caused significant damage to a few barns. Numerous trees were blown down.","",15
5132066,WILKINSON CO.,WOODVILLE,01/03/2000,1821,Tornado, ,F0,0,0,500,0,MS,CST, ,1091245,C,157,LIX,0,0,LAW ENFORCEMENT, ,.1,25,2,E,2,E,WOODVILLE,01/03/2000,1821,31.10,-91.27,31.10,-91.27,"A tornado briefly touched down just east of Woodville along Highway 24 knocking down several trees.","",16
5128185,MONTGOMERY CO.,MONTGOMERY,01/09/2000,1556,Tornado, ,F0,0,1,20000,0,AL,CST, ,1090383,C,101,BMX,0,0,BROADCAST MEDIA, ,.1,20,6,SSW,6,SSW,MONTGOMERY,01/09/2000,1556,32.30,-86.33,32.30,-86.33,"A weak tornado briefly touched down just south of exit 167 on I-65.  One motorists, traveling northbound, had his car spun around and overturned. The car was totaled and the driver sustained minor injuries.","",17
5127426,BULLOCK CO.,MIDWAY,01/09/2000,1622,Tornado, ,F0,0,0,0,0,AL,CST, ,2414825,C,11,BMX,0,0,EMERGENCY MANAGER, ,1,30,3,S,3,SE,MIDWAY,01/09/2000,1623,32.05,-85.52,32.05,-85.48,"A weak tornado briefly touched down near Midway.  Several trees were blown down.  No injuries were reported.","",18
5127502,MARENGO CO.,DIXONS MILLS,01/09/2000,2305,Tornado, ,F1,0,0,500000,0,AL,CST, ,1090209,C,91,MOB,0,0,EMERGENCY MANAGER, ,6.5,300, , , , ,SURGINER,01/09/2000,2325,32.05,-87.78,32.05,-87.70,"A tornado was reported first touching down just inside the Marengo County line about 3 miles south of Dixons Mills.  The storm then crossed U. S. Highway 43 about 2.5 miles south of Dixons Mills .  Storm track was northeast...crossing County Road 37 and then across State Highway 10 just west of  County Road 55.  The storm then moved across County Roads 55 and 45.   Almost all the damage along this track was to trees.  The tornado appeared to be near tree top level along this path.

The storm then moved across County Road 56 near Surginer just to the east of County Road 45.  This is where most of the structural damage occurred. Two mobile homes were demolished.  One home sustained major roof damage, while two others suffered roof and structural damage along County Road 56.  Damage was also done to barns and outbuildings here.  The tornado lifted back into the cloud just north of County Road 56.  No injuries were reported.","",19
5132929,COLUMBIA CO.,DAYTON,01/16/2000,900,Tornado, ,F1,0,0,100000,0,WA,PST, ,1090803,C,13,PDT,0,0,GENERAL PUBLIC, ,1,50,1,WSW, , ,DAYTON,01/16/2000,900,46.32,-118.00,46.32,-117.98,"","On January 16th a strong occluded front crossed the Columbia Basin.  This front developed from a deep low pressure system off the coast of Washington.  A line of convective showers along the front brought wind gusts of 46 mph to Walla Walla, which is 25 miles southwest of Dayton.  At 9 am, several witnesses reported that a tornado developed just south of US Highway 12 one mile southwest of Dayton.  At this location, the second story of a barn was damaged and a mobile home was flipped over.  The tornado then followed an intermittent path for around one mile through the south side of Dayton.  This path followed the floodplain of the Touchet River, which is just to the north of Rock Hill.  Rock Hill is a 700 ft. ridge just to the southwest of Dayton.  Several large trees were felled, including a 50 yard wide section of a line of trees along the east side of the river.  In the south side of Dayton, an elementary school had several shingles removed and damage to the roof's trim.  Finally, considerable damage occurred to a house on Peabody Hill just southeast of Dayton.  A large conifer fell and hit the side of a house.  A brick chimmey collapsed on this same house as well.",20
5131794,LEE CO.,ESTERO,01/24/2000,329,Tornado, ,F1,0,0,500000,0,FL,EST, ,1090963,C,71,TBW,0,0,EMERGENCY MANAGER, ,2.5,75,10,E,12,E,ESTERO,01/24/2000,333,26.43,-81.63,26.43,-81.60,"A tornado (F1) touched down approximately one mile southwest of Corkscrew road  on Lazy D Farms road where it downed a few  trees, caused minor damage to a weathered mobile home, slightly damaged two vehicles and killed two cows.   The tornado continued northeast  where it caused minor damage to three planes and a recreational vehicle in a hanger on Corkscrew Trace road.

The tornado crossed Corkscrew road and caused moderate damage to a 3000 gallon water  tank on the north side of the road.  The water tank was moved nearly a thousand yards by the tornadic wind. The tornado proceeded northeast and caused minor to moderate damage to a couple of pole barns and destroyed a storage shed along Katydid Lane.

The tornado caused minor to moderate damage to a few weathered mobile homes, pole barns and sheds along Wildcat road before it lifted and dissipated.

A total of eight homes, four pole barns, four storage sheds, several cars, an airplane hanger and several trees, were damaged by the F1 tornado.","",21
5135250,WASHOE CO.,SPARKS,02/10/2000,1340,Tornado, ,F0,0,0,0,0,NV,PST, ,1091897,C,31,REV,0,0,AIRPLANE PILOT, ,.5,15, , , , ,SPARKS,02/10/2000,1340,39.55,-119.77,39.55,-119.77,"Pilot and public reported a small tornado located 5 miles north of Sparks in Spanish Springs Valley.   No injuries were reported and only minor property damage, the amount of which is unknown.","",22
5135016,MONTGOMERY CO.,ADA,02/13/2000,1500,Tornado, ,F1,0,0,100000,0,AL,CST, ,1091564,C,101,BMX,0,0,NWS STORM SURVEY, ,11.4,300,2,SW,10,NE,ADA,02/13/2000,1517,32.07,-86.30,32.18,-86.17,"This was the first of three tornadoes produced by the same supercell thunderstorm.  The tornado moved across southern Montgomery County and produced an 11.4 mile track and was rated an F1.  The tornado began about 300 PM just southwest of Ada, and tracked to the northeast.  It lifted about 1 mile west of US 231, southwest of Teasleys Mill around 317 PM.  The tornado crossed CR 70 several times near the Davis Crossroads community.  Some of the most intense damage was a mile or two southwest of Davis Crossroads, where the Ramer Manufacturing Plant sustained considerable damage.  Several homes and mobile homes sustained damage along the path of the tornado, and hundreds of trees were snapped or uprooted.  At times, the tornado path was 300 yards wide.  A portion of the tornado was caught on video by a local television meteorologist.  The tornado was accompanied by nickel size hail.  No injuries were reported. Beginning: 32 04.788/86 18.621 Ending: 32 08.741/86 07.950","",23
5135020,MONTGOMERY CO.,DOWNING,02/13/2000,1530,Tornado, ,F0,0,0,3000,0,AL,CST, ,1091567,C,101,BMX,0,0,NWS STORM SURVEY, ,1,100,3,NNW,4,NNE,DOWNING,02/13/2000,1532,32.18,-86.02,32.18,-85.98,"","The second of three tornadoes produced by the same supercell thunderstorm began in extreme east central Montgomery County near the town of Panther.  The 3 mile path apparently began around 330 PM just west of Panther and crossed CR 36 moving into northwest Bullock County near the Piney Grove Church.  The tornado crossed CR 37 near the Mt. Zion Church area and then dissipated around 335 PM.  There were numerous trees snapped or uprooted along the 100 yard wide track.  Beginning: 32 11.206/86 00.841  Ending:  32 12.741/85 58.371",24
5135021,BULLOCK CO.,MITCHELL,02/13/2000,1532,Tornado, ,F0,0,0,15000,0,AL,CST, ,1091567,C,11,BMX,0,0,NWS STORM SURVEY, ,2,100,5,SW,3,SW,MITCHELL,02/13/2000,1535,32.18,-86.00,32.22,-85.97,"","The second of three tornadoes produced by the same supercell thunderstorm began in extreme east central Montgomery County near the town of Panther.  The 3 mile path apparently began around 330 PM just west of Panther and crossed CR 36 moving into northwest Bullock County near the Piney Grove Church.  The tornado crossed CR 37 near the Mt. Zion Church area and then dissipated around 335 PM.  There were numerous trees snapped or uprooted along the 100 yard wide track.  Beginning: 32 11.206/86 00.841  Ending:  32 12.741/85 58.371",25
5135019,BULLOCK CO.,FITZPATRICK,02/13/2000,1542,Tornado, ,F0,0,0,10000,0,AL,CST, ,1091566,C,11,BMX,0,0,NWS STORM SURVEY, ,1,50,1,NNW,3,NNE,FITZPATRICK,02/13/2000,1543,32.23,-85.88,32.25,-85.87,"The third of three tornadoes produced by the same supercell thunderstorm occurred just north of Fitzpatrick.  The tornado track was about 1 mile long and 50 yards wide.  The tornado crossed CR 7 about 2 miles north of Fitzpatrick.  Several trees were uprooted or damaged.  Beginning: 32 14.698/85 53.916  Ending: 32 15.155/85 52.937","",26
5135202,FAULKNER CO.,MAYFLOWER,02/13/2000,1652,Tornado, ,F0,0,0,0,0,AR,CST, ,1091621,C,45,LZK,0,0,NWS STORM SURVEY, ,2.2,40,2,NW,2,NE,MAYFLOWER,02/13/2000,1655,34.97,-92.45,34.97,-92.42,"A weak tornado was spawned in southern Faulkner County about 1.5 miles northwest of Mayflower. The tornado moved east, causing mostly minor damage. A couple of ornamental columns in front of a home were torn loose, with one of the columns falling into a window. Two highway signs were tipped over backwards as well. At Paradise Landing, the front windows of a store were blown in, much of the roof from a boat dock was removed,  and several nearby boat houses were damaged. Also, several trees and power lines were blown down. The tornado dissipated about 2 miles northeast of Mayflower.","",27
5135302,LONOKE CO.,FURLOW,02/13/2000,1738,Tornado, ,F2,0,2,0,0,AR,CST, ,1091622,C,85,LZK,0,0,NWS STORM SURVEY, ,17.5,100,4,N,5,NE,CARLISLE,02/13/2000,1808,34.88,-91.98,34.83,-91.68,"A strong tornado was spawned in western Lonoke County about 3.7 miles north of Furlow.  Just as the tornado developed, it removed roof shingles from a few houses and badly damaged a farm shop. A mobile home was then demolished in the Fairview community.  The worst structural damaged was found at the intersection of Arkansas Highways 31 and 236, or 4 miles south of Woodlawn. There, two small houses and some grain bins were destroyed, several vehicles and some telephone equipment were badly damaged and power poles were blown down. Farther east, more damage was found about 5 miles north of Carlisle near the intersection of Arkansas Highway 13  and East Shaefer Road. In this area, an old abandoned house and a mobile home were destroyed with a couple of houses damaged. Also, at least three dozen power poles were replaced. Two injuries were reported in Lonoke County. The tornado moved east into Prairie County, crossing the county line about 5 miles northeast of Carlisle.","",28
5133907,DAVIDSON CO.,NASHVILLE,02/13/2000,1804,Tornado, ,F1,0,1,500000,0,TN,CST, ,1091869,C,37,OHX,0,0,NWS STORM SURVEY, ,4.3,200,2,WNW,3,ENE,NASHVILLE,02/13/2000,1815,36.15,-86.87,36.15,-86.80,"About 50 homes and 20 businesses received damage from this tornado.  A 25 foot hackberry tree fell on a house.  An oak tree crashed into the side of a building. A school trailer was destroyed at St. Vincent De Paul School. There was 15 rooftop damage  at an apartment complex on Delta Street.  The hardest hit area of downtown Nashville was the Eight Avenue North and Bordeaux .  The tornado started around Scovel Street and 28th Avenue North. Extensive damage occurred from this location and to the eastnortheast for just over a mile in length. Numerous trees were uprooted or snapped. Powerlines were down. A number of homes suffered roof damage. The tornado crossed I-265 , moving eastnortheast reaching Arthur Avenue, 10th Ave. and 9th Ave. North, crossed the Cumberland River  and then reaching Dickerson Pike and Ellington Parkway, finally dissipating around Petway Avenue and Gallatin Road.

One woman was injured when an interstate sign blew into her car and caused her  to wreck.","",29
5135303,PRAIRIE CO.,HAZEN,02/13/2000,1808,Tornado, ,F2,0,0,0,0,AR,CST, ,1091623,C,117,LZK,0,0,NWS STORM SURVEY, ,15.2,100,8,NW,2,W,BISCOE,02/13/2000,1842,34.87,-91.67,34.82,-91.43,"A strong tornado that was spawned in Lonoke County moved into Prairie County, crossing the county line about 7.5 miles northwest of Hazen. Not long after entering the county, the tornado damaged or destroyed a couple of barns and several shop buildings in the Center Point community on Arkansas Highway 249.  In the same area, a mobile home was knocked off of its foundation, a home was badly damaged by a fallen tree, and shingles were removed from several roofs.  The tornado began weakening as it headed into the Wattensaw Wildlife Management Area, where some tree damage was found. The tornado dissipated about 1.7 miles west of Biscoe.","",30
5133528,WASHINGTON CO.,GREENHEAD,02/13/2000,2115,Tornado, ,F1,0,0,300000,0,FL,EST, ,1091368,C,133,TAE,0,0,EMERGENCY MANAGER, ,.5,50,4,SE,4,SE,GREENHEAD,02/13/2000,2115,30.47,-85.62,30.47,-85.62,"A tornado struck the Rolling Pines area. One home and two farm buildings were destroyed. One shed was damaged. Reported by the Washington County EMA.","",31
5133527,WASHINGTON CO.,GREENHEAD,02/13/2000,2118,Tornado, ,F1,0,0,750000,0,FL,EST, ,1091368,C,133,TAE,0,0,EMERGENCY MANAGER, ,.5,50,8,E,8,E,GREENHEAD,02/13/2000,2122,30.50,-85.53,30.50,-85.53,"A tornado struck the south and east edge of Porter Lake. Two mobile homes were destroyed and a pleasure boat capsized. Numerous utility sheds and decks were destroyed. Three small boats were blown into a nearby wooded area. Reported by the Washington County EMA.","",32
5133530,DECATUR CO.,BAINBRIDGE,02/13/2000,2319,Tornado, ,F1,0,1,1000000,0,GA,EST, ,1091370,C,87,TAE,0,0,EMERGENCY MANAGER, ,.2,50,15,NE,15,NE,BAINBRIDGE,02/13/2000,2325,31.05,-84.38,31.05,-84.38,"A tornado destroyed several homes, and downed trees and power lines at the intersection of CR 97 and  CR 262. One person was injured by flying debris. Decatur County was declared a federal disaster area.  Reported by the Decatur County EMA.","",33
5132156,MITCHELL CO.,CAMILLA,02/13/2000,2342,Tornado, ,F3,11,175,20000000,2000000,GA,EST, ,1091370,C,205,TAE,0,0,EMERGENCY MANAGER, ,9.2,300,6,SW,5,E,CAMILLA,02/14/2000,3,31.17,-84.27,31.23,-84.12,"A strong tornado tore through two major subdivisions and four mobile home parks just south of Camilla after touching down just east of Branchville.  Damage assessments from the American Red Cross and Federal Emergency Management Agency reported 200 homes destroyed and 250 homes were damaged. Two miles south of Camilla on GA Highway 112, a large trailer manufacturing plant was destroyed.  Eleven fatalities were confirmed by the Georgia Emergency Management Agency, all of which resided in mobile homes. Approximately 175 persons were injured.  The American Red Cross and Salvation Army opened several shelters for the homeless.  Hundreds of acres of pecan trees were uprooted, pine trees snapped, and power lines toppled. Numerous irrigation systems were damaged.  Property damage estimates totalled $20 million with crop losses estimated at $2 million.  Mitchell County was declared a federal disaster area. Reported by the Mitchell County EMA.","",34
5132157,GRADY CO.,CAIRO,02/14/2000,49,Tornado, ,F3,6,15,3500000,3000000,GA,EST, ,1091370,C,131,TAE,0,0,EMERGENCY MANAGER, ,8.5,300,10,N,13,NE,CAIRO,02/14/2000,55,31.02,-84.20,31.00,-84.05,"A strong tornado tore through northern Grady County, then crossed into extreme northwest Thomas County.  Fifteen homes were destroyed and numerous damaged.  Fifteen persons were injured, mostly from flying debris.  Six fatalities were confirmed by the Georgia Emergency Management Agency:  four deaths in mobile homes and two in a woodframe home.  Scores of pecan trees were uprooted, pine trees snapped and power lines toppled.  Farmers suffered major losses to irrigation equipment, trailers and shelters.  Eight chicken houses were flattened, killing a half million chickens. Grady County was declared a federal disaster area.  Reported by the Grady County EMA.","",35
