EVENT_ID,CZ_NAME_STR,BEGIN_LOCATION,BEGIN_DATE,BEGIN_TIME,EVENT_TYPE,MAGNITUDE,TOR_F_SCALE,DEATHS_DIRECT,INJURIES_DIRECT,DAMAGE_PROPERTY_NUM,DAMAGE_CROPS_NUM,STATE_ABBR,CZ_TIMEZONE,MAGNITUDE_TYPE,EPISODE_ID,CZ_TYPE,CZ_FIPS,WFO,INJURIES_INDIRECT,DEATHS_INDIRECT,SOURCE,FLOOD_CAUSE,TOR_LENGTH,TOR_WIDTH,BEGIN_RANGE,BEGIN_AZIMUTH,END_RANGE,END_AZIMUTH,END_LOCATION,END_DATE,END_TIME,BEGIN_LAT,BEGIN_LON,END_LAT,END_LON,EVENT_NARRATIVE,EPISODE_NARRATIVE,ABSOLUTE_ROWNUMBER
5263928,CAMDEN CO.,ST MARYS,09/01/2001,1556,Tornado, ,F0,0,0,1500,0,GA,EST, ,1121436,C,39,JAX,0,0,GENERAL PUBLIC, ,.1,10,0,NW, , ,ST MARYS,09/01/2001,1556,30.73,-81.55,30.73,-81.55,"Weak FO. Tops of trees damaged.","",1
5264840,NEW MADRID CO.,PARMA,09/02/2001,1227,Tornado, ,F0,0,0,0,0,MO,CST, ,1122198,C,143,PAH,0,0,LAW ENFORCEMENT, ,1.5,30,1,SW,2,NW,RISCO,09/02/2001,1239,36.60,-89.83,36.58,-89.85,"A weak tornado touched down intermittently over open farm country between Risco and Parma. Spotters and police officers visually tracked the tornado for about 10 minutes as it moved slowly southwest. No damage occurred. The parent shower or thunderstorm moved slowly west.","",2
5263648,UNION CO.,LEWISBURG,09/04/2001,1255,Tornado, ,F1,0,0,60000,0,PA,EST, ,1121395,C,119,CTP,0,0,EMERGENCY MANAGER, ,2,300,2,NW,1,SE,LEWISBURG,09/04/2001,1305,40.97,-76.92,40.93,-76.87,"An F1 tornado touched down in Kelly Township, about 2 NW of Lewisburg on Colonel John Kelly Road. The tornado traveled to the southeast, remaining north of Lewisburg. It crossed Route 15 and eventually the Susquehanna River, crossing into Northumberland County. A Township building in Kelly township was destroyed, with significant damage to a township truck. 13 utility poles were snapped off, in addition to 75 to 100 trees. Winds were estimated to be around 80 mph, classifying the tornado as a weak F1. There were no injuries or deaths.","",3
5263649,NORTHUMBERLAND CO.,MONTANDON,09/04/2001,1305,Tornado, ,F1,0,0,0,0,PA,EST, ,1121396,C,97,CTP,0,0,EMERGENCY MANAGER, ,.5,300,2,NW,1,SE,MONTANDON,09/04/2001,1310,40.98,-76.88333,40.97,-76.85,"An F1 tornado crossed into Northumberland County from Union County at 13:05 EST. This tornado had estimated wind speeds of 80s mph. The tornado entered the county about 2 miles northwest of the town of Montandon, and tracked southeast, dissipating about 1/2 mile into Northumberland county. Damage was limited a few dozen trees. Nickle size hail was reported at the State Police barraks just northeast of Montandon after to tornado dissipated. There were no injuries or deaths.","",4
5275423,BEAVER CO.,MILFORD,09/04/2001,1515,Tornado, ,F0,0,0,0,0,UT,MST, ,1125851,C,1,SLC,0,0,LAW ENFORCEMENT, ,5,20, , , , ,MILFORD,09/04/2001,1531,38.40,-113.02,38.40,-113.02,"A thunderstorm spawned a tornado which touched down 6 miles southwest of Milford, then lifted up and touched down again in the foothills east of Milford. It finally moved to about 10 miles northeast of town before dissipating. The entire event lasted about 15 minutes over open country.","",5
5270437,DALLAS CO.,CARROLLTON,09/05/2001,1325,Tornado, ,F1,0,0,125000,0,TX,CST, ,1123629,C,113,FWD,0,0,NWS STORM SURVEY, ,1.5,50, , , , ,CARROLLTON,09/05/2001,1329,32.95,-96.90,32.95,-96.90,"The initial touchdown was at the intersection of McCoy and Evergreen roads.  The tornado moved north-northwest for 1.5 miles then dissipating just north of Frankford Road and east of Old Denton Road.   Roof damage occurred at theMcCoy Elementary School, to a church, and 23 homes.","

				
Showers and thunderstorms remained in North Texas, but became more scattered, as a slow moving upper level low pressure system began to exit the region.  This upper low spawned three tornadoes in Dallas and Collin Counties which caused damage to structures.",6
5270439,COLLIN CO.,FRISCO,09/05/2001,1405,Tornado, ,F0,0,0,0,0,TX,CST, ,1123629,C,85,FWD,0,0,FIRE DEPT/RESCUE SQUAD, ,.1,20,1,E,1,E,FRISCO,09/05/2001,1405,33.15,-96.82,33.15,-96.82,"Fire department personnel observed a brief tornado touchdown in an open filed just east of Frisco.","

				
Showers and thunderstorms remained in North Texas, but became more scattered, as a slow moving upper level low pressure system began to exit the region.  This upper low spawned three tornadoes in Dallas and Collin Counties which caused damage to structures.",7
5270440,COLLIN CO.,CELINA,09/05/2001,1430,Tornado, ,F1,0,0,30000,0,TX,CST, ,1123629,C,85,FWD,0,0,LAW ENFORCEMENT, ,3,50, , , , ,CELINA,09/05/2001,1430,33.32,-96.78,33.32,-96.78,"The tornado first touched down just north of Prosper and moved due north before dissipating near Celina.  Seven homes with roof damage, one home with windows blown out, a storage shed and a greenhouse was destroyed.","

				
Showers and thunderstorms remained in North Texas, but became more scattered, as a slow moving upper level low pressure system began to exit the region.  This upper low spawned three tornadoes in Dallas and Collin Counties which caused damage to structures.",8
5265845,PALM BEACH CO.,BOYNTON BEACH,09/06/2001,1015,Tornado, ,F0,0,0,0,0,FL,EST, ,1122258,C,99,MFL,0,0,METEOROLOGIST(NON NWS), ,.5,10,3,W,3,W,BOYNTON BEACH,09/06/2001,1015,26.52,-80.08,26.52,-80.08,"The Sheriff's Office reported a tornado on the ground for about one half mile.  The tornado did no known damage and caused no casualties.","",9
5267015,MADISON CO.,PERU,09/06/2001,1352,Tornado, ,F0,0,0,0,1000,IA,CST, ,1122245,C,121,DMX,0,0,LAW ENFORCEMENT, ,.5,20,1,SE,1,SE,PERU,09/06/2001,1352,41.22,-93.90,41.22,-93.90,"Damage in a convergent path in field.","A strong upper level low pressure lifted northeast out of the southern Plains during the afternoon of the 6th.  During the heating of the afternoon, thunderstorms erupted in the unstable air.  The freezing level was around 15,000 feet, so hail was not a great threat.  Surface dew point temperatures were in the upper 60s to low 70s with precipitable water values around 1.75 inches.  Thunderstorms fired southwest of the Des Moines metropolitan area.  A tornado touched down in rural Madison County.  The tornado was about 60 feet wide and produced a half mile long path of damage in open country.    As the storms moved northeast they continued to intensity.  One cell dropped a tornado at the Glen Oaks Golf Course in West Des Moines, causing some minor damage there.  The tornado tracked northeast and flipped a semi tractor-trailer truck in Interstate 35 resulting in one injury.  It continued northeast and hit an apartment complex causing damage to the building and destroying an 8-car garage.  The path was more intermittent as it continued northeast into the city.  There were numerous reports of trees and power lines being downed.  The tornado lifted as the event transitioned into a high wind event.  The storms produced wind damage in Johnston as it moved through the area.  High winds of 80 to 85 MPH occurred in northern Polk and southern Story Counties before they weakened.  A grain bin was flattened, along with tree and crop damage, as the storm moved through the Elkhart area.  Just northwest of that, in Slater, high winds took the roof off of a house in southern Story County.  One person in the house was injured.  The storms continued to track northeast, eventually dropping another tornado in Butler and Bremer Counties.  The tornado had a somewhat intermittent track touching down south of Shell Rock and lifting northeast of Waverly.  For the most part the tornado tracked through corn fields there.  One farmstead was hit in Butler County.  A grain bin was destroyed and blown one quarter of a mile across a field, another was blown off its foundation, a shed was destroyed, and crops were damaged.  In Bremer County, one car and a garage were damaged along the tornadoes path.  Another farmstead was hit north of Waverly.  Part of a machine garage was destroyed and blown about 30 feet off of its foundation.",10
5267016,POLK CO.,WEST DES MOINES,09/06/2001,1434,Tornado, ,F1,0,1,500000,5000,IA,CST, ,1122245,C,153,DMX,0,0,LAW ENFORCEMENT, ,2.8,50,3,SW, , ,WEST DES MOINES,09/06/2001,1441,41.55,-93.75,41.58,-93.72,"Tornado touched down on southwest edge of West Des Moines at the Glen Oaks Golf Club and swept into an apartment complex.  Track was intermittent following the destruction of a garage unit there.","A strong upper level low pressure lifted northeast out of the southern Plains during the afternoon of the 6th.  During the heating of the afternoon, thunderstorms erupted in the unstable air.  The freezing level was around 15,000 feet, so hail was not a great threat.  Surface dew point temperatures were in the upper 60s to low 70s with precipitable water values around 1.75 inches.  Thunderstorms fired southwest of the Des Moines metropolitan area.  A tornado touched down in rural Madison County.  The tornado was about 60 feet wide and produced a half mile long path of damage in open country.    As the storms moved northeast they continued to intensity.  One cell dropped a tornado at the Glen Oaks Golf Course in West Des Moines, causing some minor damage there.  The tornado tracked northeast and flipped a semi tractor-trailer truck in Interstate 35 resulting in one injury.  It continued northeast and hit an apartment complex causing damage to the building and destroying an 8-car garage.  The path was more intermittent as it continued northeast into the city.  There were numerous reports of trees and power lines being downed.  The tornado lifted as the event transitioned into a high wind event.  The storms produced wind damage in Johnston as it moved through the area.  High winds of 80 to 85 MPH occurred in northern Polk and southern Story Counties before they weakened.  A grain bin was flattened, along with tree and crop damage, as the storm moved through the Elkhart area.  Just northwest of that, in Slater, high winds took the roof off of a house in southern Story County.  One person in the house was injured.  The storms continued to track northeast, eventually dropping another tornado in Butler and Bremer Counties.  The tornado had a somewhat intermittent track touching down south of Shell Rock and lifting northeast of Waverly.  For the most part the tornado tracked through corn fields there.  One farmstead was hit in Butler County.  A grain bin was destroyed and blown one quarter of a mile across a field, another was blown off its foundation, a shed was destroyed, and crops were damaged.  In Bremer County, one car and a garage were damaged along the tornadoes path.  Another farmstead was hit north of Waverly.  Part of a machine garage was destroyed and blown about 30 feet off of its foundation.",11
5267022,BUTLER CO.,SHELL ROCK,09/06/2001,1639,Tornado, ,F1,0,0,75000,10000,IA,CST, ,1122245,C,23,DMX,0,0,TRAINED SPOTTER, ,1.5,75,2,S,2,SE,SHELL ROCK,09/06/2001,1643,42.68,-92.58,42.70,-92.57,"Tornado hit grain bin and blew downwind 1/4 mile.  Shed was destroyed on a farm south of Shell Rock.  Tornado moved into Bremer County.","A strong upper level low pressure lifted northeast out of the southern Plains during the afternoon of the 6th.  During the heating of the afternoon, thunderstorms erupted in the unstable air.  The freezing level was around 15,000 feet, so hail was not a great threat.  Surface dew point temperatures were in the upper 60s to low 70s with precipitable water values around 1.75 inches.  Thunderstorms fired southwest of the Des Moines metropolitan area.  A tornado touched down in rural Madison County.  The tornado was about 60 feet wide and produced a half mile long path of damage in open country.    As the storms moved northeast they continued to intensity.  One cell dropped a tornado at the Glen Oaks Golf Course in West Des Moines, causing some minor damage there.  The tornado tracked northeast and flipped a semi tractor-trailer truck in Interstate 35 resulting in one injury.  It continued northeast and hit an apartment complex causing damage to the building and destroying an 8-car garage.  The path was more intermittent as it continued northeast into the city.  There were numerous reports of trees and power lines being downed.  The tornado lifted as the event transitioned into a high wind event.  The storms produced wind damage in Johnston as it moved through the area.  High winds of 80 to 85 MPH occurred in northern Polk and southern Story Counties before they weakened.  A grain bin was flattened, along with tree and crop damage, as the storm moved through the Elkhart area.  Just northwest of that, in Slater, high winds took the roof off of a house in southern Story County.  One person in the house was injured.  The storms continued to track northeast, eventually dropping another tornado in Butler and Bremer Counties.  The tornado had a somewhat intermittent track touching down south of Shell Rock and lifting northeast of Waverly.  For the most part the tornado tracked through corn fields there.  One farmstead was hit in Butler County.  A grain bin was destroyed and blown one quarter of a mile across a field, another was blown off its foundation, a shed was destroyed, and crops were damaged.  In Bremer County, one car and a garage were damaged along the tornadoes path.  Another farmstead was hit north of Waverly.  Part of a machine garage was destroyed and blown about 30 feet off of its foundation.",12
5267021,BREMER CO.,WAVERLY,09/06/2001,1643,Tornado, ,F2,0,0,100000,10000,IA,CST, ,1122245,C,17,DMX,0,0,EMERGENCY MANAGER, ,10,100,5,WSW,5,NE,WAVERLY,09/06/2001,1707,42.70,-92.57,42.78,-92.42,"Tornado moved in from Butler County and touched down again, mostly in open field.  A car and garage was damaged in Bremer County.","A strong upper level low pressure lifted northeast out of the southern Plains during the afternoon of the 6th.  During the heating of the afternoon, thunderstorms erupted in the unstable air.  The freezing level was around 15,000 feet, so hail was not a great threat.  Surface dew point temperatures were in the upper 60s to low 70s with precipitable water values around 1.75 inches.  Thunderstorms fired southwest of the Des Moines metropolitan area.  A tornado touched down in rural Madison County.  The tornado was about 60 feet wide and produced a half mile long path of damage in open country.    As the storms moved northeast they continued to intensity.  One cell dropped a tornado at the Glen Oaks Golf Course in West Des Moines, causing some minor damage there.  The tornado tracked northeast and flipped a semi tractor-trailer truck in Interstate 35 resulting in one injury.  It continued northeast and hit an apartment complex causing damage to the building and destroying an 8-car garage.  The path was more intermittent as it continued northeast into the city.  There were numerous reports of trees and power lines being downed.  The tornado lifted as the event transitioned into a high wind event.  The storms produced wind damage in Johnston as it moved through the area.  High winds of 80 to 85 MPH occurred in northern Polk and southern Story Counties before they weakened.  A grain bin was flattened, along with tree and crop damage, as the storm moved through the Elkhart area.  Just northwest of that, in Slater, high winds took the roof off of a house in southern Story County.  One person in the house was injured.  The storms continued to track northeast, eventually dropping another tornado in Butler and Bremer Counties.  The tornado had a somewhat intermittent track touching down south of Shell Rock and lifting northeast of Waverly.  For the most part the tornado tracked through corn fields there.  One farmstead was hit in Butler County.  A grain bin was destroyed and blown one quarter of a mile across a field, another was blown off its foundation, a shed was destroyed, and crops were damaged.  In Bremer County, one car and a garage were damaged along the tornadoes path.  Another farmstead was hit north of Waverly.  Part of a machine garage was destroyed and blown about 30 feet off of its foundation.",13
5268899,BUCHANAN CO.,AURORA,09/06/2001,1705,Tornado, ,F0,0,0,100000,0,IA,CST, ,1123290,C,19,DVN,0,0,EMERGENCY MANAGER, ,3.5,40,5,SW,2,SW,AURORA,09/06/2001,1710,42.57,-91.80,42.60,-91.75,"Tornado reported by emergency manager.","Event Summary for 09/06/01:
A strong short wave trough in the upper level atmosphere, moved northeast through Iowa and Wisconsin during the afternoon and evening hours.  This wave of energy  helped thunderstorms, which were moving along a warm front in northeast Iowa, become strong.  Despite the lack of convective available potential energy, ample moisture and wind shear along the front allowed thunderstorms within this area of rain to rotate and produce a few short lived tornadoes.  One storm in Buchanan County Iowa, produced two tornadoes as it quickly moved northeast along the warm front.

Here is a summary of the tornadoes which struck northeastern Buchanan County Iowa.

At 605 pm CDT, an F0 tornado touched down 5 miles southwest of Aurora, Iowa, producing damage to the Ralph Kramer farm site.  Several out buildings were damaged or destroyed. One empty grain bin was moved off of its foundation.  The home only had minor damage, with some siding blown off.  The tornado continued moving northeast, producing crop and tree damage as it crossed 142 street.  At 625 pm, the tornado struck the Lonnie McAllister farm site, again damaging or destroying farm out buildings.  This is also where the most significant crop damage was observed.  The tornado then lifted, leaving a trail of some tin and other debris, as the storm moved northeast.  This tornado was on the ground for 3.5 miles and was 40 yards wide at its widest point.

At 630 pm CDT, an F2 tornado touched down 0.25 miles southwest of Aurora and quickly moved across Aurora, producing damage to the roof of the American Legion building in Aurora.  The tornado then struck the Ken Mosher home just east of Aurora.  The tornado totally ripped off the roof and two car garage of this newer frame dwelling.  The tornado then lifted 0.75 miles northeast of Aurora, and no other tornadoes from this storm touched down again until it had moved about a mile north into Fayette County, Iowa.  This tornado was on the ground for 1 mile, and was 50 yards wide.",14
5262846,FAYETTE CO.,ARLINGTON,09/06/2001,1721,Tornado, ,F1,0,0,25000,15000,IA,CST, ,1121368,C,65,ARX,0,0,NWS STORM SURVEY, ,6,100,7,SW,2,NE,ARLINGTON,09/06/2001,1735,42.68,-91.77,42.77,-91.63,"","A tornado touched down near the Fayette-Buchanan county line southwest of Arlington, then skipped along before lifting near the community of Taylorsville.  The storm damaged a school near the intersection of Highways 187 and 3 southwest of Arlington.  A dairy barn was also damaged just north of Arlington.  There were no injuries reported.",15
5268900,BUCHANAN CO.,AURORA,09/06/2001,1730,Tornado, ,F2,0,0,300000,0,IA,CST, ,1123290,C,19,DVN,0,0,EMERGENCY MANAGER, ,1,50,0,SW,1,NE,AURORA,09/06/2001,1750,42.62,-91.73,42.62,-91.72,"Tornado reported by emergency manager","Event Summary for 09/06/01:
A strong short wave trough in the upper level atmosphere, moved northeast through Iowa and Wisconsin during the afternoon and evening hours.  This wave of energy  helped thunderstorms, which were moving along a warm front in northeast Iowa, become strong.  Despite the lack of convective available potential energy, ample moisture and wind shear along the front allowed thunderstorms within this area of rain to rotate and produce a few short lived tornadoes.  One storm in Buchanan County Iowa, produced two tornadoes as it quickly moved northeast along the warm front.

Here is a summary of the tornadoes which struck northeastern Buchanan County Iowa.

At 605 pm CDT, an F0 tornado touched down 5 miles southwest of Aurora, Iowa, producing damage to the Ralph Kramer farm site.  Several out buildings were damaged or destroyed. One empty grain bin was moved off of its foundation.  The home only had minor damage, with some siding blown off.  The tornado continued moving northeast, producing crop and tree damage as it crossed 142 street.  At 625 pm, the tornado struck the Lonnie McAllister farm site, again damaging or destroying farm out buildings.  This is also where the most significant crop damage was observed.  The tornado then lifted, leaving a trail of some tin and other debris, as the storm moved northeast.  This tornado was on the ground for 3.5 miles and was 40 yards wide at its widest point.

At 630 pm CDT, an F2 tornado touched down 0.25 miles southwest of Aurora and quickly moved across Aurora, producing damage to the roof of the American Legion building in Aurora.  The tornado then struck the Ken Mosher home just east of Aurora.  The tornado totally ripped off the roof and two car garage of this newer frame dwelling.  The tornado then lifted 0.75 miles northeast of Aurora, and no other tornadoes from this storm touched down again until it had moved about a mile north into Fayette County, Iowa.  This tornado was on the ground for 1 mile, and was 50 yards wide.",16
5267530,ONEIDA CO.,PELICAN LAKE,09/06/2001,1809,Tornado, ,F0,0,0,65500,0,WI,CST, ,1123038,C,85,GRB,0,0,METEOROLOGIST(NON NWS), ,.5,30,0,SSW,1,NNE,PELICAN LAKE,09/06/2001,1814,45.50,-89.12,45.52,-89.10,"","A weak tornado briefly touched down a couple of times along a 1.6 mile long path.  The tornado caused minor damage to the Pelican Lake Supper Club, blew the roof off a nearby house and destroyed a garage.  It also caused minor damage to the Pelican Lake Town Hall and uprooted several trees.

Heavy rain from thunderstorms that moved through north-central Wisconsin resulted in flooding of streets and low spots in Rhinelander (Oneida co.) and Eagle River (Vilas co.).",17
5263228,ALFALFA CO.,HELENA,09/07/2001,1425,Tornado, ,F0,0,0,0,0,OK,CST, ,1121380,C,3,OUN,0,0,STORM CHASER, ,2,50, , ,2,E,HELENA,09/07/2001,1428,36.55,-98.27,36.55,-98.23,"This tornado was captured on video over the town of Helena, moving eastward. No damage was observed or reported.","",18
5263445,SALINE CO.,ASSARIA,09/07/2001,1548,Tornado, ,F1,0,0,250000,0,KS,CST, ,1121469,C,169,ICT,0,0,LAW ENFORCEMENT, ,10,220,4,W,4,SE,SALINA,09/07/2001,1555,38.67,-97.67,38.78,-97.55,"The following were destroyed: One earthen home, one house on south side of town, numerous outbuildings, and the town's only water pump station. In addition, one barn, one garage, and one earthern home were damaged. Area newspapers contributed to this report.","",19
5266486,DICKINSON CO.,UPLAND,09/07/2001,1626,Tornado, ,F1,0,0,5000,0,KS,CST, ,1122768,C,41,TOP,0,0,TRAINED SPOTTER, ,4,200,1,S,3,NE,UPLAND,09/07/2001,1634,39.07,-97.02,39.12,-96.98,"A tornado touched down just south of Upland and moved northeast over mostly open country doing some power line damage.  The tornado crossed into Geary county at 4:34 pm.","",20
5266800,GEARY CO.,MILFORD,09/07/2001,1634,Tornado, ,F1,0,0,170000,0,KS,CST, ,1122768,C,61,TOP,0,0,NEWSPAPER, ,8,200,5,SSW,3,E,MILFORD,09/07/2001,1650,39.10,-96.95,39.17,-96.87,"The tornado mentioned above entered Geary county at 4:34 pm 5 miles southsouthwest of Milford and moved northeast across Lake Milford before dissipating 3 miles east of the town of Milford. A powerline substation was destroyed along with a 5,100 square foot maintenance facility near Lake Milford. A farmstead along the path of the tornado suffered considerable damage.","",21
5266801,DICKINSON CO.,ABILENE,09/07/2001,1659,Tornado, ,F1,0,0,8000,0,KS,CST, ,1122769,C,41,TOP,0,0,NEWSPAPER, ,.1,75, , , , ,ABILENE,09/07/2001,1659,38.92,-97.22,38.92,-97.22,"A tornado touched down in the city park and damaged 2 sheds and a concession stand before lifting moments later.","",22
5266806,RILEY CO.,OGDEN,09/07/2001,1700,Tornado, ,F0,0,0,0,0,KS,CST, ,1122770,C,161,TOP,0,0,FIRE DEPT/RESCUE SQUAD, ,.1,50,6,NW,6,NW,OGDEN,09/07/2001,1700,39.18,-96.80,39.18,-96.80,"A tornado touched down briefly over open areas of Fort Riley  damaging  some trees.","",23
5262848,MONROE CO.,ANGELO,09/07/2001,1730,Tornado, ,F0,0,1,20000,0,WI,CST, ,1121370,C,81,ARX,0,0,NWS STORM SURVEY, ,.3,30,6,N,6,N,ANGELO,09/07/2001,1732,44.05,-90.78,44.05,-90.78,"","A mobile home was hit by a tornado between Cataract and Angelo (Monroe County) along County Road Q, completely demolishing the structure and tossing it about 30 feet.  A woman was in the mobile home when the storm hit and managed to crawl out, in spite of sustaining minor injuries.  Elsewhere across southwest Wisconsin, thunderstorm winds knocked down trees and power lines.",24
5268595,GAGE CO.,ODELL,09/07/2001,1803,Tornado, ,F1,0,0,60000,0,NE,CST, ,1123166,C,67,OAX,0,0,NEWSPAPER, ,3,40,2,SW,1,E,ODELL,09/07/2001,1807,40.03,-96.82,40.05,-96.78,"A tornado tracked from southwest of Odell to just east of town near highway 8.  The tornado struck a farmstead heavily damaging 6 outbuildings and a cottonwood and cedar tree shelterbelt.  The damage path was reported to a Beatrice newspaper by the Gage county Emergency Manager.","",25
5265849,BROWARD CO.,DAVIE,09/08/2001,1225,Tornado, ,F0,0,0,0,0,FL,EST, ,1122262,C,11,MFL,0,0,EMERGENCY MANAGER, ,.2,10, , , , ,DAVIE,09/08/2001,1225,26.07,-80.23,26.07,-80.23,"A tornado touched down near SR 7 and Davie Boulevard causing no known damage or casualties.","",26
5263334,ATOKA CO.,CHOCKIE,09/08/2001,1433,Tornado, ,F0,0,0,0,0,OK,CST, ,1121382,C,5,OUN,0,0,GENERAL PUBLIC, ,.3,25, , , , ,CHOCKIE,09/08/2001,1434,34.58,-96.00,34.58,-96.00,"This tornado was observed on Highway 69, near Chockie, and appeared to skip along the ground for about one minute before dissipating. No damage was observed or reported.","",27
