EVENT_ID,CZ_NAME_STR,BEGIN_LOCATION,BEGIN_DATE,BEGIN_TIME,EVENT_TYPE,MAGNITUDE,TOR_F_SCALE,DEATHS_DIRECT,INJURIES_DIRECT,DAMAGE_PROPERTY_NUM,DAMAGE_CROPS_NUM,STATE_ABBR,CZ_TIMEZONE,MAGNITUDE_TYPE,EPISODE_ID,CZ_TYPE,CZ_FIPS,WFO,INJURIES_INDIRECT,DEATHS_INDIRECT,SOURCE,FLOOD_CAUSE,TOR_LENGTH,TOR_WIDTH,BEGIN_RANGE,BEGIN_AZIMUTH,END_RANGE,END_AZIMUTH,END_LOCATION,END_DATE,END_TIME,BEGIN_LAT,BEGIN_LON,END_LAT,END_LON,EVENT_NARRATIVE,EPISODE_NARRATIVE,ABSOLUTE_ROWNUMBER
5267346,APPANOOSE CO.,UDELL,09/20/2001,1709,Tornado, ,F1,0,0,5000,5000,IA,CST, ,1122250,C,7,DMX,0,0,LAW ENFORCEMENT, ,.5,50,3,N,3,N,UDELL,09/20/2001,1709,40.83,-92.73,40.83,-92.73,"Tornado touched down in open country, causing little damage.","A strong surge of moist and unstable air moved north into Iowa during the day on the 20th.  A warm front lifted north across the state during the day as a strong upper level disturbance approached from the west and northwest.  During the afternoon a cold front moved into northwest Iowa with a surface low forming along the front in that area.  Ahead of the front the airmass became unstable as dew point temperatures rose into the mid 60s to low 70s.  Thunderstorm erupted over north central Iowa during the early afternoon as colder temperatures moved in aloft, destabilizing the atmosphere.  Surface based convection developed by mid to late afternoon over the central and southern counties of the state.  The main severe weather feature with the storms was hail ranging from one to two inches in diameter.  Two inch diameter hail broke out windows in cars north of Northwood in Worth County.  Southeast of Northwood, near Silver Lake, hail nearly baseball in size caused considerable damage to property and crops.  Hail was reported to be drifted 3 to 4 inches deep in places.  Two inch diameter hail also fell in Hancock County at Garner.  The storms over southern Iowa, being surface based, had a higher likelihood of becoming tornadic.  Indeed one of the storms did produce a brief tornado touchdown in Appanoose County northwest of Udell.  The tornado did little damage as it touched down in open country.  A tornado also touched down in Lucas County north of Lucas.  The tornado struck a farmstead causing considerable damage to several buildings.  High winds about a mile north of the tornado damaged a machine shed and moved an outbuilding on a farmstead there.  The severe weather event began to change into a wind event toward the end of its life cycle.  Winds of 80 MPH were reported in Appanoose County in Udell for example.  High winds also swept through areas north of Centerville, and also north of Moulton in Appanoose County.",72
5263553,WOODS CO.,CAMP HOUSTON,09/20/2001,1720,Tornado, ,F0,0,0,0,0,OK,CST, ,1121387,C,151,OUN,0,0,STORM CHASER, ,.1,25,7,N,7,N,CAMP HOUSTON,09/20/2001,1723,36.90,-99.12,36.90,-99.12,"This tornado caused no damage as it remained nearly stationary, north of Camp Houston.","",73
5267484,BUCHANAN CO.,ST JOSEPH,09/20/2001,1725,Tornado, ,F0,0,0,0,0,MO,CST, ,1123303,C,21,EAX,0,0,LAW ENFORCEMENT, ,.1,.2,5,N,5,N,ST JOSEPH,09/20/2001,1725,39.83,-94.85,39.83,-94.85,"Brief tornado touchdown. No injuries or damage.","",74
5267485,BUCHANAN CO.,ST JOSEPH,09/20/2001,1734,Tornado, ,F0,0,0,0,0,MO,CST, ,1123303,C,21,EAX,0,0,LAW ENFORCEMENT, ,.1,.2, , , , ,ST JOSEPH,09/20/2001,1734,39.77,-94.85,39.77,-94.85,"Brief tornado touchdown reported at 4th and Dolman. No damage or injuries.","",75
5267486,BUCHANAN CO.,ST JOSEPH,09/20/2001,1736,Tornado, ,F0,0,0,0,0,MO,CST, ,1123303,C,21,EAX,0,0,LAW ENFORCEMENT, ,.1,.2, , , , ,ST JOSEPH,09/20/2001,1736,39.77,-94.85,39.77,-94.85,"Brief tornado touchdown near 36th street and Farron. Tornado was reported to skip up and down. No injuries or damage.","",76
5267487,BUCHANAN CO.,EASTON,09/20/2001,1755,Tornado, ,F0,0,0,0,0,MO,CST, ,1123303,C,21,EAX,0,0,AMATEUR RADIO, ,.1,.2,5,W,5,W,EASTON,09/20/2001,1755,39.72,-94.53,39.72,-94.53,"Brief tornado touchdown with no injuries or damage.","",77
5269848,CULPEPER CO.,CULPEPER,09/20/2001,1820,Tornado, ,F0,0,0,0,0,VA,EST, ,1123606,C,47,LWX,0,0,EMERGENCY MANAGER, ,.2,25,2,W,2,W,CULPEPER,09/20/2001,1820,38.48,-78.03,38.48,-78.03,"A funnel cloud briefly touched down at Lake Pelham.","A thunderstorm that moved through Culpeper County produced a brief and very weak tornado.  Residents of the Lake Pelham area report seeing a triangle shaped funnel cloud briefly touch the ground.  Little if any damage was reported at the touchdown site.  The storm moved northeast to the Catalpa area before dissipating.",78
5269492,CLAY CO.,SARONVILLE,09/22/2001,1807,Tornado, ,F0,0,0,50000,100000,NE,CST, ,1123652,C,35,GID,0,0,STORM CHASER, ,3,150,3,SW,5,SW,SARONVILLE,09/22/2001,1826,40.57,-97.97,40.55,-98.00,"A short path tornado reported by storm chasers","A cold front sagging south into a very unstable airmass was the trigger for severe thunderstorms which produced two tornadoes and some hail across the region.  Within an hour of the initial thunderstorm development, the first tornado set down southwest of Saronville in Clay county. This rope-like tornado was witnessed by many people, including numerous storm chasers, in Clay county.  The tornado drifted slowly south across farmland and damaged two pivots and did some minor crop damage.

The second tornado, which was rated an F3, was on the ground for about 30 minutes.  The tornado basically followed state highway 74 from north of Edgar in southeast Clay county, to northwest of Shickley in far southwest Fillmore county.  Along its path, 14 irrigation pivots were destroyed, at least 15 grain bins were lost and two farmsteads sustained extensive damage.  One farmhouse was deemed a total loss, while another incurred broken windows, damaged siding and minor roof damage.  Over 10,000 acres of corn and soybeans suffered an average yield loss of 30 percent.",79
5269494,CLAY CO.,EDGAR,09/22/2001,1842,Tornado, ,F3,0,0,1250000,1500000,NE,CST, ,1123652,C,35,GID,0,0,LAW ENFORCEMENT, ,9,1250,5,N,4,N,EDGAR,09/22/2001,1910,40.43,-97.97,40.42,-97.97,"Tornado exited Clay county and entered Fillmore county.","A cold front sagging south into a very unstable airmass was the trigger for severe thunderstorms which produced two tornadoes and some hail across the region.  Within an hour of the initial thunderstorm development, the first tornado set down southwest of Saronville in Clay county. This rope-like tornado was witnessed by many people, including numerous storm chasers, in Clay county.  The tornado drifted slowly south across farmland and damaged two pivots and did some minor crop damage.

The second tornado, which was rated an F3, was on the ground for about 30 minutes.  The tornado basically followed state highway 74 from north of Edgar in southeast Clay county, to northwest of Shickley in far southwest Fillmore county.  Along its path, 14 irrigation pivots were destroyed, at least 15 grain bins were lost and two farmsteads sustained extensive damage.  One farmhouse was deemed a total loss, while another incurred broken windows, damaged siding and minor roof damage.  Over 10,000 acres of corn and soybeans suffered an average yield loss of 30 percent.",80
5269495,FILLMORE CO.,SHICKLEY,09/22/2001,1910,Tornado, ,F0,0,0,0,125000,NE,CST, ,1123652,C,59,GID,0,0,NWS STORM SURVEY, ,1,100,6,W,5,NW,SHICKLEY,09/22/2001,1912,40.42,-97.83,40.47,-97.78,"Tornado entered Fillmore county from Clay county.","A cold front sagging south into a very unstable airmass was the trigger for severe thunderstorms which produced two tornadoes and some hail across the region.  Within an hour of the initial thunderstorm development, the first tornado set down southwest of Saronville in Clay county. This rope-like tornado was witnessed by many people, including numerous storm chasers, in Clay county.  The tornado drifted slowly south across farmland and damaged two pivots and did some minor crop damage.

The second tornado, which was rated an F3, was on the ground for about 30 minutes.  The tornado basically followed state highway 74 from north of Edgar in southeast Clay county, to northwest of Shickley in far southwest Fillmore county.  Along its path, 14 irrigation pivots were destroyed, at least 15 grain bins were lost and two farmsteads sustained extensive damage.  One farmhouse was deemed a total loss, while another incurred broken windows, damaged siding and minor roof damage.  Over 10,000 acres of corn and soybeans suffered an average yield loss of 30 percent.",81
5262766,ONONDAGA CO.,FABIUS,09/24/2001,1345,Tornado, ,F0,0,0,1000,0,NY,EST, ,1121358,C,67,BGM,0,0,BROADCAST MEDIA, ,.5,75, , , , ,FABIUS,09/24/2001,1400,42.83,-75.98,42.83,-75.98,"A National Weather Service storm survey confirmed an F0 tornado initially reported by members of the broadcast media. The initial touchdown occurred at the intersection of Goodrich Road and Route 80. Spotty damage was observed along a 1/2 mile long, 75 yard wide path. Most of the damage was concentrated at a residence near the initial touchdown where several large trees were downed and a small shed was destroyed. Maximum sustained winds were estimated at 50 to 70 MPH.","",82
5269850,CULPEPER CO.,RIXEYVILLE,09/24/2001,1403,Tornado, ,F4,0,2,2000000,0,VA,EST, ,1123607,C,47,LWX,0,0,NWS STORM SURVEY, ,7,75,1,SW,2,N,JEFFERSONTON,09/24/2001,1418,38.57,-77.18333,38.65,-77.13333,"A tornado damaged several buildings and destroyed one home before crossing into Fauquier County.  Two people were injured when the tornado damaged a trailer park.","Five tornadoes touched down in Northern Virginia during the afternoon and early evening of the 24th.  The thunderstorms which spawned them were created when a strong cold front moved through the region.  One tornado touched down briefly in Orange County, just a few miles west of Gordonsville.  A resident saw the tornado come "off the mountain" and twist trees along Route 645 near the intersection of Route 33.  One tree landed on a vehicle near Route 33.  It is unknown exactly how long the twister was on the ground due to the rural nature of its path, so the path length of two tenths of a mile was estimated.  The damage path was about 25 yards wide and due to the amount of tree damage it was ranked an F1.  

Shortly before the tornado touched down in Orange County, another storm produced a much stronger tornado over the northern half of Culpeper County.  The tornado was on the ground for 10 miles and touched down just east of Rixeyville on Route 640.  It was F0 strength at this location and downed a tree onto a home before moving northeast to Indian Fork Road.  On a hilltop at this location it destroyed all but the walkout basement of a two story brick house.  Debris from the home such as bricks and wood were impaled into the ground.  Plumbing and appliances were strewn across the yard and personal items such as clothing and bedding were found in trees at least 1/2 mile away.  A section of a deck was found intact 1/2 mile away and some insulation was discovered 6 miles from the site.  A car in the garage of the home was crushed by debris.  Fortunately, no one was home at the time the tornado hit.  A neighbor who witnessed the destruction said the home exploded like a bomb went off inside when the tornado "dropped onto it".  The tornado was ranked an F4 at this location with winds estimated around 210 MPH.  It weakened slightly as it moved northeast downing trees along a rural path south of Jeffersonton.  Next, it crossed through the heart of Jeffersonton along roughly Scottsville and Springs Roads at F2 strength.  Three trailer homes in the Ponderosa Trailer Court were destroyed, including one that was picked up and dropped in pieces 300 yards away.  Two people at the trailer park were injured, including one person who was hit in the back by flying debris while clinging to a pole outside.  Four churches, 4 trailer homes, 4 houses, and numerous trees and power lines were damaged in Jeffersonton.  Two barns and a garage attached to a home were destroyed.  The tornado continued to damage trees along its wooded path north of town before it crossed into Fauquier County.  The twister, now at F1 strength, remained on the ground for three more miles where it downed more trees and removed the roof of a barn.  The damage path crossed Hart Road and Holtzclaw Road, then it disappeared just north of Route 211.  

The same storm dropped a second tornado in the northern portion of Fauquier County.  This tornado touched down southwest of The Plains just south of Interstate 66. Motorists saw it cross the interstate and push northeast toward Route 55.  At the intersection of Route 55 and Bunker Hill Road, the twister struck a home at F1 strength.  It ripped off the front porch, sending debris onto cars in the driveway.  It also destroyed a pool shed and damaged several trees.  The tornado crossed Route 55 where it downed trees and power poles and pushed over a tractor trailer.  The tornado weakened to F0 strength as it tracked north near Whitewood Road.  Two homes on Milestone Road and a few smaller buildings sustained minor damage.  A few trees were damaged as the tornado continued northward just west of Halfway.  The funnel dissipated before the storm crossed into Loudoun County.  

Another thunderstorm dropped two tornadoes along the Interstate 95 and 395 corridor southwest of Washington D.C.  The first tornado touched down on Quantico Marine Corps Base just north of Garrisonville.  A funnel cloud was spotted near Garrisonville shortly before the twister touched down.  Trees were downed on the base along the path of the F0 tornado.  Personnel sited it as it passed a quarter mile west of the fire station.  The tornado continued north into Prince William County where it downed some trees in Prince William Forest Park area.  The tornado moved north into the Lake Montclair community where it took down a few trees, broke branches, and bent siding up on homes.  The weak tornado lifted shortly after.  Because the storm passed through several limited access areas, part of the tornado track was not able to be surveyed.  It is possible the tornado may not have been on the ground the entire time.

The second tornado which remained on the ground for 15 miles passed through densely populated areas of Eastern Fairfax County, the western portion of the city of Alexandria, and Arlington County.  The F1 tornado touched down just west of Fort Belvoir near Newington Road in Fairfax County.  It skipped north-northeast through Kingstown and Franconia following Beulah Street (Route 613).  Minor damage was reported at the intersections of Windsor Avenue, Fleet Drive, and Walker Lane.  Several townhomes on Beulah Street received minor damage to roofing and siding.  Debris was also reported in the Franconia Commons development.  The tornado could be seen from the Franconia-Springfield metro station.  The next report of minor damage came from the Wellington Commons and Brookland Estates communities near the intersection of Franconia Road and Route 613.  Citywide, 10 homes received minor roof damage, two businesses sustained minor damage, and 40 trees and wires were downed.  Next, the twister crossed Eisenhower Road as it moved into the western portion of the City of Alexandria.  It weakened to F0 strength and was believed to have passed just west of Alexandria Hospital and into the Fort Ward Park area.  It downed a large sign on Interstate 395 at King Road.  Minor damage was reported in the Park Fairfax and Parc East communities along Martha Custis Drive near the Arlington County border.  The tornado returned to F1 strength and continued north-northeast paralleling Interstate 395 into the Shirlington portion of Arlington County.  It passed through the Arna Valley and Club Manor Estates developments near National Hospital Medical Center.  A woman walking down 28th Street in this area was injured when a tree branch fell onto her.  Nearby, windows were shattered at a restaurant.  The next concentrated area of damage occurred in the Virginia Highlands development between Kent and Ives Streets.  Several trees and wires were downed and a few house roofs sustained damage.  A weather observer at Reagan National Airport spotted the thin funnel as it moved from Crystal City over Pentagon City and across the 14th Street Bridge and reported a second funnel descending shortly before the tornado crossed the Potomac River.  The tornado moved across Interstate 395 just south of the Pentagon where it downed trees and road signs.  One woman was injured when a tree fell onto her vehicle.  Other vehicles received broken windows from flying debris.  The tornado started to weaken fast as it crossed the 14th Street Bridge into Washington D.C.  

In addition to tornadoes, the storm produced very heavy downpours.  In Loudoun County, Town Branch in Leesburg overflowed its banks.  Several roads in low lying areas in and around town were also flooded including the Greenway at mile marker 8, Evergreen Mills Road, Loudoun Street, and the intersection of the Route 15 bypass at Sycolin Road.  Three water rescues were reported.  Street flooding was observed in Purcellville.  Rainfall reports included 4.1 to 4.8 inches in Leesburg, 3.95 inches in Lincoln and Purcellville, 3.9 inches in Ashburn, 2.60 inches in Middleburg, and 2.49 inches in Lovettsville.  In Fauquier County, Route 17 between Warrenton and Marshall was flooded.  Route 55 near Marshall was also covered with water.  Some secondary dirt roads in the northern portion of the county were partially washed out when small streams overflowed.  A total of 4.05 inches was recorded in The Plains and 2.14 inches fell in Warrenton.  In Culpeper County, 3.35 inches of rain fell in Culpeper.  In Madison County, rainfall totals included 2.80 inches in Hood, 2.77 inches at Fork Mountain, 2.65 inches in Wolftown, and 2.35 inches at Big Meadows. In Rappahannock County, 3.75 inches was reported in Castleton.",83
5270144,FAUQUIER CO.,TURNBULL,09/24/2001,1418,Tornado, ,F1,0,0,20000,0,VA,EST, ,1123607,C,61,LWX,0,0,NWS STORM SURVEY, ,3,75,2,W,3,W,WARRENTON,09/24/2001,1425,38.67,-77.88,38.72,-77.83,"A tornado damaged trees and removed a barn roof after it crossed the Culpeper County border.","Five tornadoes touched down in Northern Virginia during the afternoon and early evening of the 24th.  The thunderstorms which spawned them were created when a strong cold front moved through the region.  One tornado touched down briefly in Orange County, just a few miles west of Gordonsville.  A resident saw the tornado come "off the mountain" and twist trees along Route 645 near the intersection of Route 33.  One tree landed on a vehicle near Route 33.  It is unknown exactly how long the twister was on the ground due to the rural nature of its path, so the path length of two tenths of a mile was estimated.  The damage path was about 25 yards wide and due to the amount of tree damage it was ranked an F1.  

Shortly before the tornado touched down in Orange County, another storm produced a much stronger tornado over the northern half of Culpeper County.  The tornado was on the ground for 10 miles and touched down just east of Rixeyville on Route 640.  It was F0 strength at this location and downed a tree onto a home before moving northeast to Indian Fork Road.  On a hilltop at this location it destroyed all but the walkout basement of a two story brick house.  Debris from the home such as bricks and wood were impaled into the ground.  Plumbing and appliances were strewn across the yard and personal items such as clothing and bedding were found in trees at least 1/2 mile away.  A section of a deck was found intact 1/2 mile away and some insulation was discovered 6 miles from the site.  A car in the garage of the home was crushed by debris.  Fortunately, no one was home at the time the tornado hit.  A neighbor who witnessed the destruction said the home exploded like a bomb went off inside when the tornado "dropped onto it".  The tornado was ranked an F4 at this location with winds estimated around 210 MPH.  It weakened slightly as it moved northeast downing trees along a rural path south of Jeffersonton.  Next, it crossed through the heart of Jeffersonton along roughly Scottsville and Springs Roads at F2 strength.  Three trailer homes in the Ponderosa Trailer Court were destroyed, including one that was picked up and dropped in pieces 300 yards away.  Two people at the trailer park were injured, including one person who was hit in the back by flying debris while clinging to a pole outside.  Four churches, 4 trailer homes, 4 houses, and numerous trees and power lines were damaged in Jeffersonton.  Two barns and a garage attached to a home were destroyed.  The tornado continued to damage trees along its wooded path north of town before it crossed into Fauquier County.  The twister, now at F1 strength, remained on the ground for three more miles where it downed more trees and removed the roof of a barn.  The damage path crossed Hart Road and Holtzclaw Road, then it disappeared just north of Route 211.  

The same storm dropped a second tornado in the northern portion of Fauquier County.  This tornado touched down southwest of The Plains just south of Interstate 66. Motorists saw it cross the interstate and push northeast toward Route 55.  At the intersection of Route 55 and Bunker Hill Road, the twister struck a home at F1 strength.  It ripped off the front porch, sending debris onto cars in the driveway.  It also destroyed a pool shed and damaged several trees.  The tornado crossed Route 55 where it downed trees and power poles and pushed over a tractor trailer.  The tornado weakened to F0 strength as it tracked north near Whitewood Road.  Two homes on Milestone Road and a few smaller buildings sustained minor damage.  A few trees were damaged as the tornado continued northward just west of Halfway.  The funnel dissipated before the storm crossed into Loudoun County.  

Another thunderstorm dropped two tornadoes along the Interstate 95 and 395 corridor southwest of Washington D.C.  The first tornado touched down on Quantico Marine Corps Base just north of Garrisonville.  A funnel cloud was spotted near Garrisonville shortly before the twister touched down.  Trees were downed on the base along the path of the F0 tornado.  Personnel sited it as it passed a quarter mile west of the fire station.  The tornado continued north into Prince William County where it downed some trees in Prince William Forest Park area.  The tornado moved north into the Lake Montclair community where it took down a few trees, broke branches, and bent siding up on homes.  The weak tornado lifted shortly after.  Because the storm passed through several limited access areas, part of the tornado track was not able to be surveyed.  It is possible the tornado may not have been on the ground the entire time.

The second tornado which remained on the ground for 15 miles passed through densely populated areas of Eastern Fairfax County, the western portion of the city of Alexandria, and Arlington County.  The F1 tornado touched down just west of Fort Belvoir near Newington Road in Fairfax County.  It skipped north-northeast through Kingstown and Franconia following Beulah Street (Route 613).  Minor damage was reported at the intersections of Windsor Avenue, Fleet Drive, and Walker Lane.  Several townhomes on Beulah Street received minor damage to roofing and siding.  Debris was also reported in the Franconia Commons development.  The tornado could be seen from the Franconia-Springfield metro station.  The next report of minor damage came from the Wellington Commons and Brookland Estates communities near the intersection of Franconia Road and Route 613.  Citywide, 10 homes received minor roof damage, two businesses sustained minor damage, and 40 trees and wires were downed.  Next, the twister crossed Eisenhower Road as it moved into the western portion of the City of Alexandria.  It weakened to F0 strength and was believed to have passed just west of Alexandria Hospital and into the Fort Ward Park area.  It downed a large sign on Interstate 395 at King Road.  Minor damage was reported in the Park Fairfax and Parc East communities along Martha Custis Drive near the Arlington County border.  The tornado returned to F1 strength and continued north-northeast paralleling Interstate 395 into the Shirlington portion of Arlington County.  It passed through the Arna Valley and Club Manor Estates developments near National Hospital Medical Center.  A woman walking down 28th Street in this area was injured when a tree branch fell onto her.  Nearby, windows were shattered at a restaurant.  The next concentrated area of damage occurred in the Virginia Highlands development between Kent and Ives Streets.  Several trees and wires were downed and a few house roofs sustained damage.  A weather observer at Reagan National Airport spotted the thin funnel as it moved from Crystal City over Pentagon City and across the 14th Street Bridge and reported a second funnel descending shortly before the tornado crossed the Potomac River.  The tornado moved across Interstate 395 just south of the Pentagon where it downed trees and road signs.  One woman was injured when a tree fell onto her vehicle.  Other vehicles received broken windows from flying debris.  The tornado started to weaken fast as it crossed the 14th Street Bridge into Washington D.C.  

