EVENT_ID,CZ_NAME_STR,BEGIN_LOCATION,BEGIN_DATE,BEGIN_TIME,EVENT_TYPE,MAGNITUDE,TOR_F_SCALE,DEATHS_DIRECT,INJURIES_DIRECT,DAMAGE_PROPERTY_NUM,DAMAGE_CROPS_NUM,STATE_ABBR,CZ_TIMEZONE,MAGNITUDE_TYPE,EPISODE_ID,CZ_TYPE,CZ_FIPS,WFO,INJURIES_INDIRECT,DEATHS_INDIRECT,SOURCE,FLOOD_CAUSE,TOR_LENGTH,TOR_WIDTH,BEGIN_RANGE,BEGIN_AZIMUTH,END_RANGE,END_AZIMUTH,END_LOCATION,END_DATE,END_TIME,BEGIN_LAT,BEGIN_LON,END_LAT,END_LON,EVENT_NARRATIVE,EPISODE_NARRATIVE,ABSOLUTE_ROWNUMBER
5141596,CHIPPEWA CO.,MONTEVIDEO,04/27/2000,1258,Tornado, ,F0,0,0,0,0,MN,CST, ,1094097,C,23,MPX,0,0,LAW ENFORCEMENT, ,.1,10,4,N,4,N,MONTEVIDEO,04/27/2000,1308,45.00,-95.72,45.02,-95.72,"Tornado occasionally touching down over open ground. No damage reported.","",136
5141597,CHIPPEWA CO.,MONTEVIDEO,04/27/2000,1258,Tornado, ,F0,0,0,0,0,MN,CST, ,1094097,C,23,MPX,0,0,LAW ENFORCEMENT, ,.1,10,5,E,5,E,MONTEVIDEO,04/27/2000,1313,44.95,-95.62,44.95,-95.62,"Tornado occasionally touching down over open ground. No damage incurred.","",137
5145435,PENDER CO.,BURGAW,04/28/2000,1245,Tornado, ,F0,0,0,50000,0,NC,EST, ,1094312,C,141,ILM,0,0,EMERGENCY MANAGER, ,1,50, , , , ,BURGAW,04/28/2000,1250,34.55,-77.93,34.55,-77.93,"A small tornado tracked about a mile across western and northern Burgaw, touching down just south of the prison at the State Highway barn, at Old Savannah Road, and at Ed Cowan Road, snapping trees and damaging 4 buildings on two residencial properties.","",138
5142177,COLUMBIA CO.,ST HELENS,04/28/2000,1500,Tornado, ,F0,0,1,35000,0,OR,PST, ,1093511,C,9,PQR,0,0,LAW ENFORCEMENT, ,.1,10, , , , ,ST HELENS,04/28/2000,1500,45.87,-122.82,45.87,-122.82,"An F0 tornado touched down near Old Portland Road and Kastor Road in St. Helens.  A tree was blown over across a fence adjacent  to Old Portland Road and in front of the McCormick Park apartment building.  Another tree was broken off and fell across the apartment building.  Limbs broken off  and picked up by the winds resulted in one broken window and one minor injury.  One apartment occupant, who was on her balcony at the time, was hit in the shoulder by an airborne limb. There was about $35,000 damage to the building and fence.  There were no fatalities.","",139
5142072,MOTLEY CO.,MATADOR,04/30/2000,1320,Tornado, ,F0,0,0,0,0,TX,CST, ,1093560,C,345,LUB,0,0,TRAINED SPOTTER, ,.1,30,8,E,8,E,MATADOR,04/30/2000,1321,34.02,-100.68,34.02,-100.68,"A brief tornado touchdown in open country was reported by trained storm spotters.  No NWS storm survey was conducted.","",140
5140409,COTTLE CO.,PADUCAH,04/30/2000,1407,Tornado, ,F0,0,0,0,0,TX,CST, ,1093560,C,101,LUB,0,0,TRAINED SPOTTER, ,.1,30,4,W,4,W,PADUCAH,04/30/2000,1408,34.02,-100.37,34.02,-100.37,"Several trained storm spotters reported a brief tornado touchdown in open country.  No NWS storm survey was conducted.","",141
5141511,FOARD CO.,CROWELL,04/30/2000,1501,Tornado, ,F0,0,0,0,0,TX,CST, ,1093147,C,155,OUN,0,0,STORM CHASER, ,.2,50,6,W,6,W,CROWELL,04/30/2000,1501,33.98,-99.82,33.98,-99.82,"This tornado was closely intersected by a Doppler-On-Wheels chase team 6 miles west of Crowell. No structures or trees were present to be affected by strong winds, and thus it was rated F0.","Numerous severe thunderstorms moved across western portions of north Texas during the afternoon and evening of the 30th. Four tornadoes were confirmed, and there were numerous reports of large hail and some straight-line wind damage.",142
5141512,FOARD CO.,CROWELL,04/30/2000,1520,Tornado, ,F0,0,0,0,0,TX,CST, ,1093147,C,155,OUN,0,0,STORM CHASER, ,3,50,2,SW,1,N,CROWELL,04/30/2000,1530,33.97,-99.73,34.00,-99.72,"This tornado was also closely intersected by a Doppler-On-Wheels chase team and was later confirmed by another chase team associated with the MOCISE project. The tornado developed 2 miles southwest of Crowell just south of Highway 70 and tracked northward before turning to the right as it dissipated 1 mile north of Crowell. Power flashes were observed early in its development, and thus the tornado has earned an F0 rating.","Numerous severe thunderstorms moved across western portions of north Texas during the afternoon and evening of the 30th. Four tornadoes were confirmed, and there were numerous reports of large hail and some straight-line wind damage.",143
5141513,FOARD CO.,CROWELL,04/30/2000,1527,Tornado, ,F0,0,0,0,0,TX,CST, ,1093147,C,155,OUN,0,0,STORM CHASER, ,2,50,2,E,4,ENE,CROWELL,04/30/2000,1534,33.98,-99.68,34.00,-99.65,"This tornado was indentified by a Doppler-On-Wheels chase team 2 miles east of Crowell while another tornado dissipated. Small debris consisting of small tree limbs and leaves, was observed moving rapidly northward across a Doppler-On-Wheels chase vehicle, and thus the tornado has been rated F0.","Numerous severe thunderstorms moved across western portions of north Texas during the afternoon and evening of the 30th. Four tornadoes were confirmed, and there were numerous reports of large hail and some straight-line wind damage.",144
5142214,THROCKMORTON CO.,ELBERT,04/30/2000,1609,Tornado, ,F1,0,0,50000,0,TX,CST, ,1093868,C,447,SJT,0,0,NWS EMPLOYEE(OFF DUTY), ,4,500,5,W,1,NW,ELBERT,04/30/2000,1625,33.25,-99.08,33.28,-99.02,"A tornado developed west of Elbert, tracking along a 4 mile path to just northwest of Elbert.","An isolated supercell spawned two tornadoes across Throckmorton County. The first tornado dropped down in open county and produced only minimal damage. However, the second tornado developed very near the community of Elbert, striking the town as the tornado moved east. Most of the buildings in town suffered some degree of damage. Fortunately, the residents in town had taken proper refuge and there were no reported injuries.",145
5142215,THROCKMORTON CO.,ELBERT,04/30/2000,1625,Tornado, ,F1,0,0,200000,0,TX,CST, ,1093868,C,447,SJT,0,0,NWS EMPLOYEE(OFF DUTY), ,2,500, , ,2,E,ELBERT,04/30/2000,1630,33.27,-99.00,33.25,-98.97,"A tornado struck the small community of Elbert. There was considerable damage to mobile homes and metal buildings, with lesser damage noted in permanent structures. A cotton gin was destroyed, with the silo blown northeast across State Highway 79. The tornado apparently first touched down near Elbert, tracking eastward along State Highway 79 to the Young County line. Fortunately, there were no reported injuries.","An isolated supercell spawned two tornadoes across Throckmorton County. The first tornado dropped down in open county and produced only minimal damage. However, the second tornado developed very near the community of Elbert, striking the town as the tornado moved east. Most of the buildings in town suffered some degree of damage. Fortunately, the residents in town had taken proper refuge and there were no reported injuries.",146
5139361,WILBARGER CO.,OKLAUNION,04/30/2000,1630,Tornado, ,F1,0,0,50000,0,TX,CST, ,1093147,C,487,OUN,0,0,EMERGENCY MANAGER, ,2,75,2,SE,4,E,OKLAUNION,04/30/2000,1638,34.12,-99.12,34.13,-99.07,"This tornado formed 1.5 miles southeast of Oklaunion on the south side of Highway 287 with information of its existence coming from a Doppler-On-Wheels chase team, but was later confirmed by descriptions of damage from the Oklaunion Fire Department. One tied down mobile home on the north side of Highway 287 was ripped up by the wind and strewn over a half mile area. The base of the mobile home was picked up and placed against the side of a barn 20 feet to its east. Three large barns had roof and wall damage, and one barn had several two by fours stuck sideways into its east-facing wall. Two grain storage bins had their roofs blown off, and the foundation of one bin was moved about 18 inches. One shed was damaged, and another was blown away. Also, a driver traveling on Highway 287 pulled over to the side of the road to wait out the storm and had a two by four blown through the back window. Although this tornado was rated F1, most damage is consistent with F0 damage.","Numerous severe thunderstorms moved across western portions of north Texas during the afternoon and evening of the 30th. Four tornadoes were confirmed, and there were numerous reports of large hail and some straight-line wind damage.",147
5141083,YOUNG CO.,OLNEY,04/30/2000,1640,Tornado, ,F0,0,0,0,0,TX,CST, ,1094131,C,503,FWD,0,0,NEWSPAPER, ,.2,20, , , , ,OLNEY,04/30/2000,1640,33.37,-98.77,33.37,-98.77,"A brief tornado touched down on the west side of Olney. No damage or injuries were reported.","						
				April 30, 2000 - Event Narrative

A big day for severe weather across northwest portions of the area.  Several outflow boundaries, a dryline, and moist unstable air all helped contribute to thunderstorm development.  There were several rounds of thunderstorms, the first wave was in the early morning hours, from about 3 am to 5 am. This activity developed in Young and Palo Pinto counties and moved eastward to affect Parker, Jack, Wise and Tarrant counties.  

Another event developed in the early evening, generally north and west of a Dallas, Glen Rose, Eastland line.  Most of the activity was centered on Young, Jack, and Stephens county.  A large tornado occurred near Olney (Young County) during this event. A continuation of aa tornado that began in Throckmorton county.",148
5142115,YOUNG CO.,OLNEY,04/30/2000,1640,Tornado, ,F3,0,0,300000,0,TX,CST, ,1094131,C,503,FWD,0,0,NEWSPAPER, ,13,800, , , , ,OLNEY,04/30/2000,1640,33.37,-98.77,33.37,-98.77,"A large tornado was reported from near the county line (between Elbert and Padgett) to east of Olney. A 100 year old home was completely destroyed one mile south of the Olney Airport. A total of three homes and two motor homes were destroyed. Damage was reported to a nursing home, barns, power lines and trees. Most of the damage, however, occurred in open country.","						
				April 30, 2000 - Event Narrative

A big day for severe weather across northwest portions of the area.  Several outflow boundaries, a dryline, and moist unstable air all helped contribute to thunderstorm development.  There were several rounds of thunderstorms, the first wave was in the early morning hours, from about 3 am to 5 am. This activity developed in Young and Palo Pinto counties and moved eastward to affect Parker, Jack, Wise and Tarrant counties.  

Another event developed in the early evening, generally north and west of a Dallas, Glen Rose, Eastland line.  Most of the activity was centered on Young, Jack, and Stephens county.  A large tornado occurred near Olney (Young County) during this event. A continuation of aa tornado that began in Throckmorton county.",149
5140673,YOUNG CO.,GRAHAM,04/30/2000,1750,Tornado, ,F0,0,0,0,0,TX,CST, ,1094131,C,503,FWD,0,0,NWS EMPLOYEE(OFF DUTY), ,.1,10,15,N,15,N,GRAHAM,04/30/2000,1750,33.32,-98.60,33.32,-98.60,"A brief touchdown was reported by an off duty National Weather Service meteorologist.","						
				April 30, 2000 - Event Narrative

A big day for severe weather across northwest portions of the area.  Several outflow boundaries, a dryline, and moist unstable air all helped contribute to thunderstorm development.  There were several rounds of thunderstorms, the first wave was in the early morning hours, from about 3 am to 5 am. This activity developed in Young and Palo Pinto counties and moved eastward to affect Parker, Jack, Wise and Tarrant counties.  

Another event developed in the early evening, generally north and west of a Dallas, Glen Rose, Eastland line.  Most of the activity was centered on Young, Jack, and Stephens county.  A large tornado occurred near Olney (Young County) during this event. A continuation of aa tornado that began in Throckmorton county.",150
5140679,YOUNG CO.,SOUTH BEND,04/30/2000,1831,Tornado, ,F0,0,0,0,0,TX,CST, ,1094131,C,503,FWD,0,0,FIRE DEPT/RESCUE SQUAD, ,.2,10,2,NE,2,NE,SOUTH BEND,04/30/2000,1831,33.02,-98.65,33.02,-98.65,"A brief touchdown was reported by storm chasers.","						
				April 30, 2000 - Event Narrative

A big day for severe weather across northwest portions of the area.  Several outflow boundaries, a dryline, and moist unstable air all helped contribute to thunderstorm development.  There were several rounds of thunderstorms, the first wave was in the early morning hours, from about 3 am to 5 am. This activity developed in Young and Palo Pinto counties and moved eastward to affect Parker, Jack, Wise and Tarrant counties.  

Another event developed in the early evening, generally north and west of a Dallas, Glen Rose, Eastland line.  Most of the activity was centered on Young, Jack, and Stephens county.  A large tornado occurred near Olney (Young County) during this event. A continuation of aa tornado that began in Throckmorton county.",151
5140680,YOUNG CO.,BUNGER,04/30/2000,1840,Tornado, ,F0,0,0,0,0,TX,CST, ,1094131,C,503,FWD,0,0,NEWSPAPER, ,.2,10,2,N,2,N,BUNGER,04/30/2000,1840,33.05,-98.60,33.05,-98.60,"A brief touchdown was reported by chasers.","						
				April 30, 2000 - Event Narrative

A big day for severe weather across northwest portions of the area.  Several outflow boundaries, a dryline, and moist unstable air all helped contribute to thunderstorm development.  There were several rounds of thunderstorms, the first wave was in the early morning hours, from about 3 am to 5 am. This activity developed in Young and Palo Pinto counties and moved eastward to affect Parker, Jack, Wise and Tarrant counties.  

Another event developed in the early evening, generally north and west of a Dallas, Glen Rose, Eastland line.  Most of the activity was centered on Young, Jack, and Stephens county.  A large tornado occurred near Olney (Young County) during this event. A continuation of aa tornado that began in Throckmorton county.",152
5140682,JACK CO.,BRYSON,04/30/2000,1846,Tornado, ,F0,0,0,0,0,TX,CST, ,1094131,C,237,FWD,0,0,NWS EMPLOYEE(OFF DUTY), ,.2,10,5,S,5,S,BRYSON,04/30/2000,1846,33.10,-98.38,33.10,-98.38,"A brief touchdown by rain wrapped tornado was reported by an off duty National Weather Service meteorologist.","						
				April 30, 2000 - Event Narrative

A big day for severe weather across northwest portions of the area.  Several outflow boundaries, a dryline, and moist unstable air all helped contribute to thunderstorm development.  There were several rounds of thunderstorms, the first wave was in the early morning hours, from about 3 am to 5 am. This activity developed in Young and Palo Pinto counties and moved eastward to affect Parker, Jack, Wise and Tarrant counties.  

Another event developed in the early evening, generally north and west of a Dallas, Glen Rose, Eastland line.  Most of the activity was centered on Young, Jack, and Stephens county.  A large tornado occurred near Olney (Young County) during this event. A continuation of aa tornado that began in Throckmorton county.",153
